{
  "protocol_id": "ML-001",
  "version": "1.0.0",
  "name": "Mechanical Load Static Test (2400Pa)",
  "category": "mechanical",
  "standard": {
    "name": "IEC",
    "code": "IEC 61215 MQT 16",
    "version": "4.0",
    "url": "https://webstore.iec.ch/publication/61345"
  },
  "description": "Static mechanical load test to determine the ability of a PV module to withstand wind, snow, ice, and static loads. The module is subjected to a uniform load of 2400 Pa applied perpendicular to the module surface for a specified duration. This test evaluates structural integrity, deflection characteristics, and electrical performance degradation under load.",
  "duration_minutes": 180,
  "equipment_required": [
    {
      "name": "Mechanical Load Test Frame",
      "type": "load_application_system",
      "model": "Universal PV Module Test Frame",
      "calibration_required": true,
      "calibration_interval_days": 365
    },
    {
      "name": "Pressure Distribution System",
      "type": "air_bladder_system",
      "model": "Uniform Load Application Bladder",
      "calibration_required": false
    },
    {
      "name": "Pressure Sensor",
      "type": "sensor",
      "model": "Digital Pressure Transducer ±0.5% accuracy",
      "calibration_required": true,
      "calibration_interval_days": 180
    },
    {
      "name": "Deflection Measurement System",
      "type": "laser_displacement_sensor",
      "model": "Laser Distance Meter ±0.1mm accuracy",
      "calibration_required": true,
      "calibration_interval_days": 365
    },
    {
      "name": "Data Acquisition System",
      "type": "daq",
      "model": "Multi-channel DAQ System",
      "calibration_required": true,
      "calibration_interval_days": 365
    },
    {
      "name": "IV Curve Tracer",
      "type": "electrical_tester",
      "model": "Precision IV Curve Tracer",
      "calibration_required": true,
      "calibration_interval_days": 180
    },
    {
      "name": "Visual Inspection Camera",
      "type": "inspection_equipment",
      "model": "High Resolution Digital Camera",
      "calibration_required": false
    }
  ],
  "safety_requirements": [
    "Wear safety glasses at all times",
    "Ensure test area is clear of personnel during load application",
    "Use proper lifting techniques when handling modules (minimum 2 persons for modules >20kg)",
    "Verify pressure system integrity before test initiation",
    "Install emergency stop button within reach",
    "Ensure adequate lighting for visual inspection",
    "Follow electrical safety protocols during IV measurements",
    "Secure module to prevent sliding or shifting during test"
  ],
  "environmental_conditions": {
    "temperature_celsius": {
      "min": 15,
      "max": 35,
      "target": 25
    },
    "humidity_percent": {
      "min": 20,
      "max": 75,
      "target": 50
    },
    "pressure_pa": {
      "min": 95000,
      "max": 105000,
      "target": 101325
    }
  },
  "tests": [
    {
      "step_id": "ML-001-S01",
      "name": "Pre-Test Visual Inspection",
      "sequence": 1,
      "description": "Conduct thorough visual inspection of the module to document baseline condition before applying mechanical load",
      "duration_minutes": 15,
      "parameters": {
        "inspection_type": "visual",
        "documentation_required": true,
        "photo_documentation": true,
        "min_photo_resolution": "12MP"
      },
      "measurements": [],
      "acceptance_criteria": {
        "no_visible_defects": true,
        "frame_integrity": "intact",
        "glass_condition": "no_cracks_or_chips",
        "junction_box_secure": true
      },
      "operator_instructions": [
        "Photograph module from all angles (front, back, edges)",
        "Check for any existing cracks, chips, or defects in glass",
        "Inspect frame for dents, corrosion, or damage",
        "Verify junction box is securely attached",
        "Document cell interconnections visible through glass",
        "Note any discoloration or delamination",
        "Record module serial number and specifications",
        "Complete pre-test inspection checklist"
      ]
    },
    {
      "step_id": "ML-001-S02",
      "name": "Baseline Electrical Characterization",
      "sequence": 2,
      "description": "Measure initial electrical parameters to establish baseline performance before mechanical loading",
      "duration_minutes": 20,
      "parameters": {
        "test_type": "iv_curve",
        "irradiance_wm2": 1000,
        "module_temperature_celsius": 25,
        "spectrum": "AM1.5G",
        "measurement_uncertainty": "±3%"
      },
      "measurements": [
        {
          "measurement_type": "open_circuit_voltage",
          "unit": "V",
          "interval_seconds": 1,
          "sensor_id": "IV_TRACER_01"
        },
        {
          "measurement_type": "short_circuit_current",
          "unit": "A",
          "interval_seconds": 1,
          "sensor_id": "IV_TRACER_01"
        },
        {
          "measurement_type": "max_power",
          "unit": "W",
          "interval_seconds": 1,
          "sensor_id": "IV_TRACER_01"
        },
        {
          "measurement_type": "fill_factor",
          "unit": "ratio",
          "interval_seconds": 1,
          "sensor_id": "IV_TRACER_01"
        },
        {
          "measurement_type": "module_temperature",
          "unit": "°C",
          "interval_seconds": 5,
          "sensor_id": "TEMP_SENSOR_01",
          "target_value": 25,
          "tolerance": 2
        }
      ],
      "acceptance_criteria": {
        "voc_within_spec": true,
        "isc_within_spec": true,
        "pmax_within_spec": true,
        "temperature_stable": true
      },
      "operator_instructions": [
        "Allow module to stabilize at 25°C ±2°C",
        "Clean module surface with approved cleaning method",
        "Position module under solar simulator",
        "Verify irradiance uniformity across module surface",
        "Perform IV curve trace",
        "Record Voc, Isc, Pmax, Vmp, Imp, FF",
        "Compare results to manufacturer nameplate ratings",
        "Save IV curve data to test database"
      ]
    },
    {
      "step_id": "ML-001-S03",
      "name": "Module Mounting and Setup",
      "sequence": 3,
      "description": "Mount module securely in test frame with proper support and measurement instrumentation",
      "duration_minutes": 20,
      "parameters": {
        "mounting_type": "supported_edges",
        "support_configuration": "all_four_edges",
        "edge_support_width_mm": 25,
        "mounting_angle_degrees": 0,
        "bladder_type": "uniform_pressure"
      },
      "measurements": [],
      "acceptance_criteria": {
        "module_level": true,
        "secure_mounting": true,
        "sensors_calibrated": true,
        "bladder_positioned": true
      },
      "operator_instructions": [
        "Mount module in test frame with glass side facing up",
        "Support all four edges with minimum 25mm overlap",
        "Ensure module is level (±1 degree)",
        "Position deflection sensors at center and quarter points",
        "Install pressure sensors at multiple points",
        "Position air bladder system over module glass surface",
        "Ensure bladder covers entire module area uniformly",
        "Connect sensors to data acquisition system",
        "Verify all sensor readings are zero/baseline",
        "Perform sensor calibration check"
      ]
    },
    {
      "step_id": "ML-001-S04",
      "name": "Load Application to 2400Pa",
      "sequence": 4,
      "description": "Apply uniform mechanical load of 2400 Pa (equivalent to ~240 kg/m²) to module surface",
      "duration_minutes": 60,
      "parameters": {
        "target_pressure_pa": 2400,
        "pressure_ramp_rate_pa_per_min": 100,
        "pressure_tolerance_pa": 50,
        "hold_duration_minutes": 60,
        "loading_direction": "front_surface_compression"
      },
      "measurements": [
        {
          "measurement_type": "applied_pressure",
          "unit": "Pa",
          "interval_seconds": 10,
          "sensor_id": "PRESSURE_01",
          "target_value": 2400,
          "tolerance": 50,
          "min_value": 0,
          "max_value": 3000
        },
        {
          "measurement_type": "deflection_center",
          "unit": "mm",
          "interval_seconds": 10,
          "sensor_id": "DEFLECT_CENTER",
          "min_value": 0,
          "max_value": 50
        },
        {
          "measurement_type": "deflection_quarter_point_1",
          "unit": "mm",
          "interval_seconds": 10,
          "sensor_id": "DEFLECT_Q1"
        },
        {
          "measurement_type": "deflection_quarter_point_2",
          "unit": "mm",
          "interval_seconds": 10,
          "sensor_id": "DEFLECT_Q2"
        },
        {
          "measurement_type": "deflection_quarter_point_3",
          "unit": "mm",
          "interval_seconds": 10,
          "sensor_id": "DEFLECT_Q3"
        },
        {
          "measurement_type": "deflection_quarter_point_4",
          "unit": "mm",
          "interval_seconds": 10,
          "sensor_id": "DEFLECT_Q4"
        },
        {
          "measurement_type": "ambient_temperature",
          "unit": "°C",
          "interval_seconds": 60,
          "sensor_id": "TEMP_AMBIENT",
          "min_value": 15,
          "max_value": 35
        }
      ],
      "acceptance_criteria": {
        "pressure_within_tolerance": true,
        "max_deflection_mm": 40,
        "no_visible_damage": true,
        "no_audible_cracking": true,
        "deflection_symmetry_percent": 20
      },
      "operator_instructions": [
        "Verify all personnel clear of test area",
        "Initiate data acquisition recording",
        "Begin gradual pressure application at 100 Pa/min",
        "Monitor pressure uniformity across bladder",
        "Observe module for any visible deformation",